,Unnamed: 0.1,Unnamed: 0,repository,topic,open_issues_count,open_issues,pushed_at,updated_at,created_at,fork_count,stargazer_count,description,fork,language
13809,101624,101642,OWASP/SSO_Project,[],14.0,14.0,2022-02-11T08:48:02Z,2022-05-06T09:23:53Z,2020-02-10T14:33:11Z,16.0,60.0,"OWASP Single Sign-On allows a secure-by-default self-hosted SSO experience, including phishing-proof two-factor authentication, using state-of-the-art security mechanisms.",False,JavaScript
13810,101643,101661,dorny/test-reporter,"['ci-cd', 'github-actions', 'reporting', 'testing']",45.0,45.0,2022-05-16T21:35:03Z,2022-06-03T20:55:59Z,2020-10-01T20:53:23Z,55.0,267.0,Displays test results from popular testing frameworks directly in GitHub,False,TypeScript
13811,101647,101665,drwpow/openapi-typescript,[],29.0,29.0,2022-06-02T03:36:55Z,2022-06-04T15:02:17Z,2018-12-13T20:28:01Z,154.0,1797.0,Generate TypeScript types from Swagger OpenAPI specs,False,TypeScript
13812,101650,101668,cisagov/cset,"['cset', 'security-audit']",58.0,58.0,2022-06-03T09:28:08Z,2022-06-04T08:36:20Z,2019-05-15T17:09:53Z,173.0,911.0,Cybersecurity Evaluation Tool,False,TSQL
13813,101661,101679,bazelbuild/rules_go,"['bazel', 'bazel-rules', 'cgo', 'go', 'golang']",250.0,250.0,2022-06-04T17:10:01Z,2022-06-02T03:34:00Z,2016-03-15T15:15:14Z,512.0,1068.0,Go rules for Bazel,False,Go
13814,101685,101703,meanjs/mean,[],211.0,211.0,2021-08-12T18:56:32Z,2022-06-01T16:31:53Z,2013-12-29T13:01:15Z,2038.0,4894.0,"MEAN.JS - Full-Stack JavaScript Using MongoDB, Express, AngularJS, and Node.js - ",False,JavaScript
13815,101744,101762,alykoshin/gmail-send,[],30.0,30.0,2021-09-29T17:30:43Z,2022-06-02T04:08:13Z,2015-10-03T20:09:45Z,24.0,80.0,Minimalistic module to send email using GMail ,False,JavaScript
13816,101752,101770,cnodejs/nodeclub,[],224.0,224.0,2022-06-01T04:33:15Z,2022-06-02T04:40:37Z,2012-02-15T07:41:26Z,3202.0,9215.0,:baby_chick:Nodeclub 是使用 Node.js 和 MongoDB 开发的社区系统,False,JavaScript
13817,101775,101793,cds-snc/report-a-cybercrime,"['beta', 'cybercrime', 'rcmp']",65.0,65.0,2021-04-30T07:39:13Z,2021-12-12T21:27:52Z,2018-10-24T13:58:23Z,12.0,28.0,Report a computer crime or scam / Signaler un crime informatique ou une fraude,False,JavaScript
13818,101868,101886,lukevella/rallly,[],4.0,4.0,2022-06-04T08:32:16Z,2022-06-04T15:10:31Z,2015-01-27T17:01:38Z,82.0,791.0,Self-hostable doodle poll alternative. Find the best date for a meeting with your colleagues or friends without the back and forth emails.,False,TypeScript
13819,101872,101890,retrospect-addon/plugin.video.retrospect,"['addon', 'kodi', 'kodi-addon', 'livestream', 'python', 'python2', 'python3', 'retrospect', 'streaming', 'tv', 'vod']",33.0,33.0,2022-05-27T21:17:31Z,2022-05-15T04:15:31Z,2019-08-21T13:28:27Z,28.0,77.0,Retrospect is a Kodi video add-on which allows you to watch streams of a number of free and publicly available online TV stream sites.,False,Python
13820,101874,101892,acm309/PutongOJ,"['koa', 'mongodb', 'node', 'onlinejudge', 'redis']",16.0,16.0,2022-05-31T04:38:47Z,2022-05-09T14:00:15Z,2017-05-22T15:36:53Z,25.0,170.0,Putong Online Judge -- An online judge with nothing special,False,JavaScript
13821,101882,101900,dojot/flowbroker,"['core', 'dojot', 'flow', 'hacktoberfest', 'iot']",10.0,10.0,2022-05-27T17:39:20Z,2021-11-26T14:16:31Z,2018-03-06T10:20:19Z,27.0,3.0,"Flow processing implementation, with hot deployment capabilities",False,JavaScript
13822,101890,101908,slackapi/bolt-js-getting-started-app,[],0.0,0.0,2022-03-18T15:38:37Z,2022-05-31T09:37:08Z,2020-08-27T21:50:17Z,35.0,20.0,Getting Started Slack app using ⚡️ Bolt for JavaScript,False,JavaScript
13823,101903,101921,fastify/github-action-merge-dependabot,"['dependabot', 'pull-requests']",4.0,4.0,2022-05-30T08:06:20Z,2022-05-24T16:17:00Z,2020-11-11T14:23:33Z,20.0,94.0,This action automatically approves and merges dependabot PRs.,False,JavaScript
13824,101904,101922,OpenObservability/OpenMetrics,[],14.0,14.0,2022-03-31T18:02:31Z,2022-06-03T12:47:27Z,2017-06-22T09:24:47Z,132.0,1765.0,Evolving the Prometheus exposition format into a standard.,False,Go
13825,101915,101933,RetroAchievements/RAWeb,[],20.0,20.0,2022-06-04T14:54:37Z,2022-05-26T15:47:51Z,2018-02-12T13:37:42Z,32.0,85.0,RetroAchievements.org site and server backend,False,PHP
13826,101918,101936,bevry/caterpillar,"['caterpillar', 'client-side', 'deno', 'logger', 'logging', 'nodejs', 'pipe', 'transform-streams']",11.0,11.0,2022-04-28T22:00:52Z,2022-06-04T07:24:52Z,2011-09-06T05:42:16Z,14.0,389.0,"Caterpillar is the ultimate logging system for Deno, Node.js, and Web Browsers. Log levels are implemented to the RFC standard. Log entries can be filtered and piped to various streams, including coloured output to the terminal, the browser's console, and debug files. You can even write your own transforms.",False,TypeScript
13827,101926,101944,sysdotini/hibiki,[],0.0,0.0,2022-06-03T19:32:20Z,2022-05-31T12:01:09Z,2020-03-24T04:33:01Z,46.0,167.0,"⚓ The best all-in-one Discord bot. Music, moderation, utilities, locale support, a sleek web UI, and more.",False,TypeScript
13828,101927,101945,nextcloud/viewer,"['fileinfo', 'hacktoberfest', 'javascript', 'media', 'nextcloud', 'nextcloud-app', 'photo-gallery', 'photos', 'videos', 'viewer', 'vue', 'vuejs']",80.0,80.0,2022-06-04T01:00:55Z,2022-06-02T12:10:11Z,2019-02-19T19:28:31Z,35.0,65.0,🖼 Simple file viewer with slideshow for media,False,JavaScript
13829,101954,101972,moleculerjs/moleculer-addons,"['addon', 'microservices', 'moleculer', 'official-addons']",5.0,5.0,2022-05-14T17:17:34Z,2022-04-28T21:54:00Z,2017-05-23T14:13:24Z,37.0,77.0,:gift: Official addons for Moleculer framework,False,JavaScript
13830,101973,101991,postmanlabs/postman-sandbox,"['contextify', 'postman', 'sandbox', 'vm']",6.0,6.0,2022-06-03T22:02:47Z,2022-06-01T16:00:12Z,2016-11-30T08:19:26Z,40.0,73.0,Sandbox for Postman Scripts to run in Node.js or browser,False,JavaScript
13831,101979,101997,postmanlabs/postman-url-encoder,"['postman', 'url', 'url-encoder', 'url-parser', 'whatwg-url']",15.0,15.0,2022-05-27T22:03:35Z,2022-03-24T11:40:31Z,2017-02-01T13:36:57Z,10.0,12.0,Implements URL encoding according to the WHATWG specification,False,JavaScript
13832,101985,102003,CodeChefVIT/Quizzie,"['answers', 'competitions', 'events', 'hacktoberfest', 'leaderboard', 'marks', 'mcq', 'nodejs', 'open-source', 'polls', 'questions', 'quiz', 'quizzie', 'react', 'winners']",5.0,5.0,2022-04-09T07:40:05Z,2022-03-01T15:57:56Z,2020-06-21T08:59:45Z,33.0,31.0,Open Sourced Quiz Portal which can be used for any event / competition with a custom leaderboard.,False,JavaScript
13833,101986,102004,CodeChefVIT/FFDS,"['codechefvit', 'ffcs', 'ffds', 'fully-flexible-dating-system', 'time-table', 'vit']",7.0,7.0,2021-06-05T08:32:18Z,2021-06-13T17:19:20Z,2020-04-06T17:34:29Z,11.0,9.0,"Platform to find out when a user is free and connect them to other users in the same free slot in VIT to chat, meet up and chill-out.",False,JavaScript
13834,102006,102024,nextcloud/cdav-library,"['caldav', 'carddav', 'cdav-library', 'javascript', 'js', 'library', 'nextcloud', 'rfc4791', 'rfc6352']",13.0,13.0,2022-06-04T01:08:16Z,2022-03-30T13:15:52Z,2018-01-13T13:46:31Z,12.0,42.0,:date: 📇 CalDAV and CardDAV client library for JavaScript,False,JavaScript
13835,102011,102029,mui/mui-x,"['data-grid', 'data-table', 'react']",421.0,421.0,2022-06-04T16:03:57Z,2022-06-03T19:38:47Z,2020-04-30T14:52:39Z,293.0,1648.0,MUI X: Advanced and powerful React components for complex use-cases.,False,TypeScript
13836,102025,102043,streetsidesoftware/vscode-spell-checker,[],158.0,158.0,2022-06-03T09:05:26Z,2022-06-02T06:49:30Z,2016-05-16T10:42:22Z,86.0,852.0,A simple source code spell checker for code,False,TypeScript
13837,102026,102044,marudor/libxmljs2,['hacktoberfest'],14.0,14.0,2022-05-03T21:32:24Z,2022-05-08T10:26:37Z,2020-08-01T10:52:05Z,14.0,31.0,,False,C++
13838,102063,102081,toondaey/nestjs-pdf,"['html-pdf', 'nestjs', 'nestjs-backend', 'nestjs-pdf']",20.0,20.0,2022-06-04T13:24:38Z,2022-06-03T21:58:47Z,2020-05-01T01:14:27Z,16.0,40.0,Nest js pdf generator,False,TypeScript
13839,102067,102085,termux/termux-app,"['android', 'linux', 'terminal', 'termux']",274.0,274.0,2022-06-01T14:23:44Z,2022-06-04T16:08:29Z,2015-10-23T09:42:46Z,1772.0,13109.0,Termux - a terminal emulator application for Android OS extendible by variety of packages.,False,Java
13840,102074,102092,newrelic/newrelic-java-agent-ansible-role,[],4.0,4.0,2021-08-17T15:05:11Z,2021-08-17T15:26:05Z,2020-02-25T21:15:34Z,10.0,2.0,Ansible role for installing New Relic Java agent,False,Jinja
13841,102077,102095,ozum/pg-generator,[],24.0,24.0,2022-05-14T07:43:41Z,2022-04-24T22:03:34Z,2014-12-23T18:04:57Z,20.0,80.0,Template Based Scaffolding Tool for PostgreSQL. Create files and ORM models automatically.,False,HTML
13842,102093,102111,linnovate/root,[],172.0,172.0,2022-04-28T00:44:18Z,2021-07-26T06:39:39Z,2015-03-18T08:50:13Z,23.0,22.0,Root - Meanstack based productivity ,False,JavaScript
13843,102113,102131,lisong/code-push-server,"['code-push', 'code-push-server', 'cordova', 'react-native']",133.0,133.0,2022-05-24T21:56:33Z,2022-06-03T04:00:43Z,2016-03-16T08:16:34Z,482.0,1644.0,CodePush service is hot update services which adapter react-native-code-push and cordova-plugin-code-push - 热更新,False,JavaScript
13844,102203,102221,openqasm/openqasm,"['ibmqx', 'qiskit', 'quantum-computing', 'quantum-information']",55.0,55.0,2022-06-03T22:08:59Z,2022-06-04T13:48:22Z,2017-03-03T17:03:30Z,267.0,816.0,Quantum assembly language for extended quantum circuits,False,TeX
13845,102204,102222,vmware/clarity,"['accessibility', 'accessible-components', 'accessible-design', 'angular', 'angular-components', 'clarity', 'component-library', 'components', 'css', 'design-system', 'lit-elements', 'typescript', 'ui', 'ux', 'web', 'web-components', 'web-components-library']",2.0,2.0,2022-05-19T12:39:36Z,2022-05-28T19:39:56Z,2016-09-29T17:24:17Z,762.0,6459.0,"Clarity is a scalable, accessible, customizable, open source design system built with web components. Works with any JavaScript framework, built for enterprises, and designed to  be inclusive.",False,TypeScript
13846,102206,102224,googlemaps/js-markerclustererplus,[],1.0,1.0,2021-12-08T02:10:50Z,2022-05-01T16:08:33Z,2020-09-11T19:22:36Z,45.0,100.0,,False,TypeScript
13847,102207,102225,ewels/MegaQC,[],106.0,106.0,2022-06-01T10:57:54Z,2022-05-17T05:15:57Z,2017-03-07T15:24:09Z,25.0,73.0,Web application to collect and visualise data across multiple MultiQC runs.,False,Python
13848,102209,102227,telekom/voice-skill-sdk,"['python', 'sdk', 'skill', 'skill-sdk', 'skills', 'smartspeaker']",9.0,9.0,2022-04-07T09:16:37Z,2022-05-03T10:22:30Z,2020-11-09T14:10:57Z,15.0,17.0,The official Magenta Voice Skill SDK used to develop skills for the Magenta Voice Assistant using Voice Platform!,False,Python
13849,102212,102230,vbpf/ebpf-verifier,"['abstract-interpretation', 'ebpf', 'ebpf-verifier', 'static-analyzer']",25.0,25.0,2022-05-28T22:22:56Z,2022-05-27T22:02:54Z,2018-06-16T03:04:33Z,32.0,209.0,eBPF verifier based on abstract interpretation,False,C++
13850,102225,102243,vapor/websocket-kit,"['server-side-swift', 'spm', 'swift', 'swift-nio', 'vapor', 'websockets']",19.0,19.0,2022-06-01T16:03:44Z,2022-06-02T23:07:10Z,2018-04-16T22:46:47Z,61.0,184.0,WebSocket client library built on SwiftNIO,False,Swift
13851,102235,102253,Orange-OpenSource/Orange-Boosted-Bootstrap,[],182.0,182.0,2022-06-03T09:51:08Z,2022-05-30T06:31:18Z,2015-11-23T08:31:53Z,40.0,123.0,"Orange Boosted is a framework library accessible, ergonomic and Orange branded based on Bootstrap",False,JavaScript
13852,102241,102259,openwisp/openwisp-wifi-login-pages,"['captivepage', 'hacktoberfest', 'networking', 'openwisp', 'wifi', 'wifi-service']",15.0,15.0,2022-06-01T08:43:32Z,2022-05-22T15:40:33Z,2019-05-13T13:28:58Z,59.0,68.0,"Configurable captive page for public/private WiFi services providing login, sign up, social login, SMS verification, change password, reset password, change phone number and more.",False,JavaScript
13853,102254,102272,foambubble/foam,"['graph-visualisation', 'markdown', 'markdown-editor', 'note-taking', 'notes-app', 'personal-knowledge-base', 'pkm', 'vscode', 'zettelkasten']",127.0,127.0,2022-06-04T12:20:14Z,2022-06-04T03:09:13Z,2020-06-19T17:04:10Z,510.0,11991.0,A personal knowledge management and sharing system for VSCode,False,TypeScript
13854,102257,102275,pubgrub-rs/pubgrub,['dependency-solver'],23.0,23.0,2022-05-30T06:14:17Z,2022-06-02T10:51:05Z,2020-09-11T14:01:40Z,10.0,130.0,PubGrub version solving algorithm implemented in Rust,False,Rust
13855,102263,102281,aio-libs/aiosmtpd,"['asyncio', 'email', 'lmtp', 'mail-mta', 'mta', 'python', 'smtp', 'smtp-mta', 'smtp-server', 'smtpd']",46.0,46.0,2022-04-22T13:57:50Z,2022-06-03T14:24:33Z,2016-07-14T13:51:17Z,76.0,236.0,A reimplementation of the Python stdlib smtpd.py based on asyncio.,False,Python
13856,102266,102284,connorshea/vglist,"['game-tracker', 'rails', 'rails-app', 'rails-application', 'tracker-application', 'tracking', 'video-game-collection', 'video-game-library', 'video-games', 'wikidata']",43.0,43.0,2022-06-02T13:05:34Z,2022-05-26T17:01:18Z,2018-12-29T00:12:26Z,21.0,123.0,A video game library tracking web app built in Rails and powered by Wikidata.,False,Ruby
13857,102309,102327,target/goalert,[],76.0,76.0,2022-06-03T17:20:40Z,2022-06-02T08:32:31Z,2019-05-24T16:46:20Z,153.0,1597.0,"Open source on-call scheduling, automated escalations, and notifications so you never miss a critical alert",False,Go
13858,102312,102330,HangarMC/Hangar,"['java', 'jdbi', 'minecraft', 'nuxt', 'plugin-repository', 'spring', 'vue', 'vuetify']",54.0,54.0,2022-06-03T16:36:59Z,2022-06-02T22:36:30Z,2020-07-08T15:21:05Z,48.0,146.0,A plugin repository used for paper plugins,False,Java
13859,102348,102366,ergebnis/composer-normalize,"['composer', 'composer-plugin', 'json', 'normalizer']",6.0,6.0,2022-06-02T09:47:32Z,2022-05-28T13:04:30Z,2018-01-12T17:02:18Z,27.0,813.0,:musical_note: Provides a composer plugin for normalizing composer.json.,False,PHP
13860,102352,102370,ergebnis/phpstan-rules,"['phpstan', 'phpstan-extreme-rules', 'phpstan-rules']",6.0,6.0,2022-05-30T09:01:39Z,2022-06-03T13:38:04Z,2018-11-13T11:42:12Z,15.0,258.0,:eyeglasses: Provides additional rules for phpstan/phpstan.,False,PHP
13861,102367,102385,Vizzuality/trase,[],56.0,56.0,2022-06-02T09:04:16Z,2022-05-30T21:57:20Z,2017-02-16T15:55:05Z,12.0,31.0,Source code for Trase API and Frontend applications,False,Ruby
13862,102381,102399,ruby/fiddle,"['fiddle', 'libffi', 'ruby']",20.0,20.0,2022-05-04T16:47:26Z,2022-05-25T17:36:31Z,2017-04-05T00:03:38Z,30.0,128.0,A libffi wrapper for Ruby.,False,Ruby
13863,102385,102403,Airfordable/ecs-deploy-task-definition-to-scheduled-task,[],16.0,16.0,2022-06-04T04:49:31Z,2022-05-31T11:36:46Z,2020-05-05T21:11:59Z,13.0,20.0,Creates a new ECS task definition and deploys it to related scheduled tasks within a given cluster,False,JavaScript
13864,102392,102410,newrelic/aws_s3_log_ingestion_lambda,[],13.0,13.0,2022-03-14T20:45:14Z,2022-05-12T18:09:57Z,2020-06-11T20:33:33Z,15.0,9.0,AWS Lambda that sends log data from S3 to New Relic Logging,False,Python
13865,102411,102429,rstudio/bookdown,"['book', 'bookdown', 'epub', 'gitbook', 'html', 'latex', 'rmarkdown']",172.0,172.0,2022-05-17T07:37:27Z,2022-06-04T13:38:09Z,2015-10-28T05:03:18Z,1130.0,2971.0,Authoring Books and Technical Documents with R Markdown,False,JavaScript
13866,102413,102431,Asgoret/devopshelper_bot,"['bot', 'devops', 'python', 'telegram-bot']",24.0,24.0,2022-02-07T12:01:44Z,2022-03-19T23:18:04Z,2020-07-31T09:39:07Z,11.0,10.0,This bot used for helping in administation and moderation DevOps groups in telegram.,False,Python
13867,102414,102432,GiulioRossetti/dynetx,"['complex-networks', 'dynamic-networks', 'network-analysis']",16.0,16.0,2022-05-21T00:33:55Z,2022-03-29T08:37:28Z,2017-07-29T16:55:15Z,26.0,78.0,Dynamic Network Analysis library,False,Python
13868,102420,102438,migueldeicaza/gui.cs,"['csharp', 'curses', 'dotnet', 'gui', 'terminal', 'toolkit']",78.0,78.0,2022-06-04T16:37:48Z,2022-06-04T14:17:00Z,2017-12-11T03:23:45Z,528.0,6609.0,Console-based user interface toolkit for .NET applications.,False,C#
13869,102440,102458,redkubes/otomi-core,"['argocd', 'developer-selfservice', 'devops', 'gitops', 'helm', 'istio', 'knative-serving', 'kubernetes', 'paas']",49.0,49.0,2022-06-03T21:01:31Z,2022-06-04T10:58:38Z,2019-08-01T21:03:07Z,60.0,1060.0,Self-hosted PaaS for Kubernetes,False,Mustache
13870,102452,102470,codetheweb/muse,"['discord', 'discord-js', 'music', 'spotify', 'youtube']",34.0,34.0,2022-06-03T23:42:06Z,2022-06-04T10:07:33Z,2020-03-07T23:04:00Z,72.0,235.0,🎧 a self-hosted midwestern Discord music bot that doesn't suck,False,TypeScript
13871,102468,102486,tsand/responsive-sketchpad,"['canvas', 'html5-canvas-sketchpad', 'javascript', 'mobile-sketchpad', 'responsive']",13.0,13.0,2022-06-01T10:50:40Z,2022-06-01T05:22:27Z,2013-04-14T23:31:43Z,44.0,142.0,"A completely responsive, HTML5 canvas sketchpad for use on desktop and mobile browsers",False,TypeScript
13872,102499,102517,mitre/heimdall2,['mitre-saf'],155.0,155.0,2022-06-04T15:28:09Z,2022-06-03T18:53:36Z,2020-04-15T19:59:46Z,31.0,99.0,"Heimdall Enterprise Server 2 lets you view, store, and compare automated security control scan results.",False,TypeScript
13873,102500,102518,hundertzehn/mocoapp-browser-extension,[],19.0,19.0,2022-06-01T06:08:31Z,2022-05-11T11:40:59Z,2018-07-05T09:01:03Z,14.0,7.0,,False,JavaScript
13874,102512,102530,adobe/aio-cli-plugin-cloudmanager,"['adobe-experience-manager', 'adobe-io', 'adobe-io-cli', 'adobe-io-cli-plugin', 'cloudmanager']",18.0,18.0,2022-05-16T01:05:24Z,2022-05-24T19:08:07Z,2019-05-31T14:47:15Z,19.0,31.0,Cloud Manager plugin for the Adobe I/O CLI,False,JavaScript
13875,102526,102544,module-federation/module-federation-examples,"['demo', 'examples', 'federated', 'federation', 'federation-dashboard', 'module', 'module-federation', 'nextjs', 'stream-federated']",44.0,44.0,2022-06-03T21:04:09Z,2022-06-04T07:52:23Z,2020-04-30T21:02:25Z,894.0,2946.0,"Implementation examples of module federation , by the creators of module federation",False,JavaScript
13876,102552,102570,cloudposse/actions,"['actions', 'ci', 'ci-cd', 'cicd', 'git', 'github', 'github-actions']",12.0,12.0,2022-06-02T15:31:07Z,2022-04-02T13:13:25Z,2019-08-24T06:44:37Z,13.0,38.0,Our Library of GitHub Actions,False,TypeScript
13877,102558,102576,DadosAbertosDeFeira/portal,"['civic-tech', 'dados-abertos', 'feira-de-santana', 'hacktoberfest', 'tecnologias-civicas']",16.0,16.0,2022-03-28T16:15:37Z,2021-12-04T22:33:02Z,2020-01-22T18:40:08Z,16.0,12.0,O site do Dados Abertos de Feira 💻,False,JavaScript
13878,102576,102594,arogozine/LinqToTypeScript,"['async', 'async-await', 'async-iteration', 'enumerable', 'es2019', 'javascript', 'linq', 'typescript']",1.0,1.0,2022-03-30T01:44:36Z,2022-05-22T00:12:58Z,2016-11-09T13:47:48Z,12.0,74.0,LINQ to TypeScript,False,TypeScript
13879,102619,102637,dalance/procs,"['cli', 'process', 'rust']",14.0,14.0,2022-05-25T01:32:26Z,2022-06-04T11:08:57Z,2019-01-28T12:19:23Z,61.0,2878.0,A modern replacement for ps written in Rust,False,Rust
13880,102632,102650,actions/stale,[],18.0,18.0,2022-06-01T11:40:28Z,2022-06-03T13:16:44Z,2019-08-04T01:32:21Z,205.0,679.0,Marks issues and pull requests that have not had recent interaction,False,TypeScript
13881,102633,102651,google/blockly,[],533.0,533.0,2022-06-03T21:25:00Z,2022-06-04T16:54:42Z,2013-10-25T21:13:33Z,3335.0,10307.0,The web-based visual programming editor.,False,JavaScript
13882,102634,102652,maticnetwork/heimdall,"['dapps', 'decentralized-applications', 'ethereum', 'matic', 'proof-of-stake']",3.0,3.0,2022-06-03T13:58:01Z,2022-06-03T05:06:55Z,2018-11-01T10:17:22Z,74.0,104.0,Validator node for Matic PoS  layer,False,Go
13883,102636,102654,AppiumTestDistribution/AppiumTestDistribution,"['android', 'appium', 'appium-ios', 'automation', 'browserstack', 'cloudtesting', 'cucumber', 'cucumberappium', 'mp4box', 'parallel', 'parallel-computing', 'parallel-ios', 'parallelappium', 'parallelappiumandroid', 'parallelappiumios', 'saucelabs', 'testng']",42.0,42.0,2022-06-02T18:02:41Z,2022-06-03T01:36:32Z,2015-08-18T16:22:15Z,339.0,848.0,A tool for running android and iOS appium tests in parallel across devices... U like it STAR it !,False,Java
13884,102648,102666,komoot/photon,"['elasticsearch', 'geocoder', 'geocoding', 'java', 'openstreetmap', 'photon', 'reverse-geocoding', 'search']",75.0,75.0,2022-04-28T08:59:00Z,2022-06-03T13:04:27Z,2013-08-20T16:06:16Z,241.0,1428.0,an open source geocoder for openstreetmap data,False,Java
13885,102666,102684,simonplend/express-json-validator-middleware,"['ajv', 'express', 'express-middleware', 'expressjs', 'json', 'json-schema', 'json-schemas']",10.0,10.0,2022-05-20T19:38:16Z,2022-06-02T05:09:02Z,2017-03-24T15:33:00Z,21.0,139.0,Express middleware for validating requests against JSON schema,False,JavaScript
13886,102669,102687,chunky-dev/chunky,"['hacktoberfest', 'java', 'minecraft', 'path-tracer']",181.0,181.0,2022-05-31T21:30:31Z,2022-05-28T21:00:37Z,2012-11-09T08:27:27Z,65.0,506.0,A path tracer to create realistic images of your Minecraft worlds.,False,Java
13887,102684,102702,FreeRTOS/coreJSON,[],0.0,0.0,2021-12-22T19:13:42Z,2022-06-01T09:14:25Z,2020-08-26T22:51:15Z,43.0,47.0,"A parser strictly enforcing the ECMA-404 JSON standard, suitable for microcontrollers",False,C
13888,102686,102704,FreeRTOS/coreMQTT,[],1.0,1.0,2022-06-02T23:42:33Z,2022-06-01T09:11:50Z,2020-08-26T22:49:32Z,56.0,73.0,Client implementation of the MQTT 3.1.1 specification for embedded devices,False,C
13889,102688,102706,aws/Device-Defender-for-AWS-IoT-embedded-sdk,[],1.0,1.0,2021-12-22T19:11:10Z,2022-05-25T09:01:10Z,2020-09-16T00:27:30Z,22.0,6.0,Client library for using AWS IoT Defender service on embedded devices,False,C
13890,102690,102708,aws/Device-Shadow-for-AWS-IoT-embedded-sdk,[],0.0,0.0,2021-12-22T19:10:57Z,2022-05-25T09:01:34Z,2020-09-02T23:31:28Z,29.0,18.0,Client library for using AWS IoT Shadow service on embedded devices,False,C
13891,102691,102709,FreeRTOS/backoffAlgorithm,[],0.0,0.0,2021-12-22T19:13:56Z,2022-05-25T09:02:32Z,2020-11-18T20:57:33Z,19.0,9.0,Algorithm for calculating exponential backoff with jitter for network retry attempts. ,False,C
13892,102692,102710,aws/Jobs-for-AWS-IoT-embedded-sdk,[],0.0,0.0,2021-12-22T19:07:54Z,2022-05-25T09:01:52Z,2020-09-16T00:30:20Z,22.0,9.0,Client library for using AWS IoT Jobs service on embedded devices,False,C
13893,102701,102719,networkservicemesh/sdk-vpp,[],19.0,19.0,2022-06-03T15:15:07Z,2022-05-16T08:02:48Z,2020-11-18T02:00:38Z,14.0,1.0,,False,Go
13894,102711,102729,uPortal-Project/uPortal,"['academic', 'college', 'education', 'enterprise', 'gradle', 'hacktoberfest', 'higher-education', 'java', 'portal', 'portlet', 'soffit', 'spring', 'tomcat', 'university', 'uportal', 'uportal-start-bundled']",71.0,71.0,2022-06-02T18:19:41Z,2022-05-01T06:04:19Z,2011-10-20T15:34:22Z,268.0,233.0,Enterprise open source portal built by and for the higher education community.,False,Java
13895,102756,102774,jsonresume/resume-cli,"['cli', 'javascript', 'json', 'resume']",93.0,93.0,2022-05-23T04:04:24Z,2022-06-02T11:11:00Z,2014-06-15T06:21:01Z,372.0,4126.0,CLI tool to easily setup a new resume 📑,False,JavaScript
13896,102763,102781,jhotmann/node-rename-cli,"['cli', 'hacktoberfest', 'node', 'rename-files']",17.0,17.0,2022-05-27T23:04:22Z,2022-05-06T11:32:17Z,2017-03-03T17:50:43Z,17.0,134.0,"A tool for renaming files quickly, especially multiple files at once.",False,JavaScript
13897,102765,102783,dalance/svlint,"['lint', 'linter', 'rust', 'systemverilog', 'verilog']",4.0,4.0,2022-05-25T01:40:20Z,2022-06-04T03:41:47Z,2019-10-21T11:36:55Z,17.0,152.0,SystemVerilog linter,False,Rust
13898,102766,102784,dalance/svls,"['language-server', 'rust', 'systemverilog', 'verilog']",12.0,12.0,2022-05-13T09:22:34Z,2022-05-21T23:31:40Z,2019-11-15T05:34:40Z,18.0,210.0,SystemVerilog language server,False,Rust
13899,102772,102790,geotools/geotools,"['geojson', 'geospatial', 'geotools', 'gis', 'java', 'mongodb', 'mysql', 'oracle-spatial', 'postgis', 'shapefile', 'sqlserver']",14.0,14.0,2022-06-03T14:18:36Z,2022-06-02T08:39:47Z,2011-11-10T23:22:12Z,1013.0,1290.0,Official GeoTools repository,False,Java
13900,102782,102800,garimasingh128/ToDoista,[],25.0,25.0,2021-12-22T07:55:41Z,2021-12-08T11:41:59Z,2020-05-24T10:16:03Z,39.0,14.0,A ToDo app :orange_book: made using MERN. Keep a track of your activities on a single click. :thought_balloon:  :computer:,False,JavaScript
13901,102803,102821,apache/incubator-heron,"['heron', 'messaging', 'streaming']",411.0,411.0,2022-06-02T23:08:01Z,2022-05-28T05:22:24Z,2015-09-25T16:09:24Z,620.0,3586.0,"Apache Heron (Incubating) is a realtime, distributed, fault-tolerant stream processing engine from Twitter",False,Java
13902,102815,102833,algolia/algolia-sitemap,"['algolia', 'seo', 'sitemap', 'sitemap-generator']",23.0,23.0,2022-05-15T18:50:49Z,2022-03-09T09:39:06Z,2017-04-26T15:28:21Z,10.0,32.0,a node library allowing you to generate sitemaps from an Algolia index. ,False,JavaScript
13903,102822,102840,Azure/azure-cli,"['azure', 'azure-cli', 'cloud']",2564.0,2564.0,2022-06-04T03:59:23Z,2022-06-03T10:17:20Z,2016-02-04T00:21:51Z,2148.0,3084.0,Azure Command-Line Interface,False,Python
13904,102823,102841,neighborhood999/vue-signature-pad,"['components', 'signature-pad', 'vue', 'vue-components']",38.0,38.0,2022-06-01T21:34:30Z,2022-06-02T05:44:02Z,2018-01-31T03:11:47Z,61.0,361.0,🖋 Vue Signature Pad Component,False,JavaScript
13905,102828,102846,cybershard/auproximity,"['among-us', 'amongus', 'bepinex', 'positional-data', 'voice', 'webui']",11.0,11.0,2021-04-16T19:19:57Z,2022-05-10T00:38:01Z,2020-11-19T20:28:50Z,49.0,189.0,"AUProximity is an open source proximity voice chat platform, primarily aimed at Among Us.",False,TypeScript
