,Unnamed: 0.1,Unnamed: 0,repository,topic,open_issues_count,open_issues,pushed_at,updated_at,created_at,fork_count,stargazer_count,description,fork,language
18576,155723,155751,kubernetes-ui/topology-graph,[],4.0,4.0,2018-08-03T16:54:47Z,2022-05-30T16:26:32Z,2015-06-02T16:40:00Z,40.0,94.0,,False,JavaScript
18577,155730,155758,unicef/magicbox,"['data', 'data-science', 'emergency-response', 'emergency-situation', 'geospatial', 'geospatial-data', 'humanitarian', 'javascript', 'magicbox', 'nodejs', 'unicef', 'united-nations']",15.0,15.0,2019-08-31T23:59:54Z,2022-05-17T22:05:19Z,2016-10-24T21:16:04Z,19.0,80.0,A platform that uses real-time data to inform life-saving humanitarian responses to emergency situations,False,
18578,155732,155760,JuliaCollections/DataStructures.jl,"['data-structures', 'julia']",185.0,185.0,2022-05-24T10:52:15Z,2022-06-04T08:02:31Z,2013-03-13T16:28:14Z,220.0,556.0,Julia implementation of Data structures,False,Julia
18579,155735,155763,tidymodels/infer,[],2.0,2.0,2022-06-01T15:12:28Z,2022-05-26T04:43:48Z,2017-06-05T17:41:42Z,71.0,645.0,An R package for tidyverse-friendly statistical inference,False,R
18580,155736,155764,getredash/redash,"['analytics', 'athena', 'bi', 'bigquery', 'business-intelligence', 'dashboard', 'databricks', 'hacktoberfest', 'javascript', 'mysql', 'postgresql', 'python', 'redash', 'redshift', 'spark', 'spark-sql', 'visualization']",724.0,724.0,2022-06-01T16:15:19Z,2022-06-04T12:41:43Z,2013-10-28T13:19:39Z,3697.0,21177.0,"Make Your Company Data Driven. Connect to any data source, easily visualize, dashboard and share your data.",False,Python
18581,155739,155767,fossasia/susi_chromebot,[],71.0,71.0,2020-12-16T11:21:48Z,2022-06-03T01:24:23Z,2017-09-20T15:17:20Z,139.0,1534.0,SUSI.AI Chrome Extension,False,JavaScript
18582,155743,155771,fossasia/publiccode.asia,[],59.0,59.0,2021-06-14T18:04:51Z,2022-06-03T13:36:59Z,2017-11-25T05:23:07Z,175.0,1468.0,Website of https://publiccode.asia,False,JavaScript
18583,155744,155772,Leanplum/Leanplum-Unity-SDK,"['abtesting', 'analytics', 'automation', 'messaging', 'personalization']",0.0,0.0,2022-05-23T14:38:42Z,2022-05-10T07:55:44Z,2014-10-23T19:59:26Z,10.0,8.0,Leanplum's integrated solution delivers meaningful engagement across messaging and the in-app experience.,False,C++
18584,155745,155773,Leanplum/Leanplum-JavaScript-SDK,"['abtesting', 'analytics', 'automation', 'messaging', 'personalization']",3.0,3.0,2022-06-04T00:06:23Z,2021-12-22T07:27:03Z,2017-03-24T19:51:13Z,15.0,5.0,Leanplum's integrated solution delivers meaningful engagement across messaging and the in-app experience.,False,TypeScript
18585,155746,155774,Leanplum/Leanplum-Android-SDK,"['abtesting', 'analytics', 'appediting', 'automation', 'messaging', 'personalization']",0.0,0.0,2022-05-18T08:03:23Z,2022-05-10T07:55:13Z,2017-04-26T21:21:23Z,43.0,42.0,Leanplum's integrated solution delivers meaningful engagement across messaging and the in-app experience.,False,Java
18586,155753,155781,codevise/pageflow,"['multimedia-storytelling', 'scrollytelling', 'storytelling']",39.0,39.0,2022-06-02T14:19:54Z,2022-06-02T13:35:36Z,2014-05-05T06:50:13Z,116.0,649.0,Multimedia story telling for the web.,False,JavaScript
18587,155756,155784,src-d/jgit-spark-connector,"['datasource', 'git', 'pyspark', 'python', 'scala', 'spark']",11.0,11.0,2019-02-13T13:43:52Z,2022-06-02T05:17:29Z,2017-08-03T10:55:44Z,34.0,71.0,jgit-spark-connector is a library for running scalable data retrieval pipelines that process any number of Git repositories for source code analysis.,False,Scala
18588,155764,155792,electron/apps,"['apps', 'community', 'electron', 'open-source']",16.0,16.0,2022-06-04T11:29:06Z,2022-05-26T00:57:28Z,2016-08-31T19:35:56Z,1565.0,1542.0,A collection of apps built on Electron,False,JavaScript
18589,155769,155797,streamich/unionfs,"['filesystem', 'fs', 'union', 'unionfs']",36.0,36.0,2022-06-03T23:00:14Z,2022-05-10T09:07:27Z,2015-06-14T19:12:00Z,14.0,166.0,Use multiple fs modules at once,False,TypeScript
18590,155771,155799,zendframework/zend-servicemanager,[],23.0,23.0,2020-01-30T16:33:00Z,2022-02-13T07:30:40Z,2015-05-08T13:28:10Z,92.0,191.0,ServiceManager component from Zend Framework,False,PHP
18591,155780,155808,cyberImperial/attack-graphs,[],7.0,7.0,2019-05-18T22:14:10Z,2022-05-26T09:05:05Z,2017-10-14T11:50:41Z,14.0,17.0,Attack graph construction and analysis,False,Python
18592,155784,155812,mslinn/web3j-scala,"['ethereum', 'json-rpc', 'scala', 'solc', 'solidity', 'web3j']",17.0,17.0,2021-12-23T12:08:54Z,2022-05-09T12:08:05Z,2017-11-07T20:03:05Z,20.0,78.0,Lightweight and idiomatic Scala wrapper around Web3J for Ethereum.,False,Scala
18593,155792,155820,mohebifar/react-native-copilot,"['intro', 'react-native', 'walkthrough']",113.0,113.0,2022-06-02T00:03:53Z,2022-05-31T13:09:28Z,2017-10-06T17:32:03Z,338.0,1859.0,Step-by-step walkthrough for your react native app,False,JavaScript
18594,155793,155821,fossasia/susi.ai,[],136.0,136.0,2022-06-01T22:01:40Z,2022-06-04T03:55:33Z,2016-07-17T09:56:00Z,818.0,1963.0,SUSI.AI Web Client https://susi.ai,False,JavaScript
18595,155798,155826,stretchr/objx,"['go', 'golang', 'objx']",3.0,3.0,2022-05-08T11:03:12Z,2022-05-28T10:20:14Z,2013-09-10T19:45:41Z,65.0,518.0,"Go package for dealing with maps, slices, JSON and other data.",False,Go
18596,155805,155833,aerospike/aerospike-client-csharp,[],2.0,2.0,2022-06-01T01:52:14Z,2022-02-06T19:17:14Z,2014-04-10T17:26:52Z,37.0,62.0,Aerospike C# Client Library,False,C#
18597,155808,155836,JoinColony/colonyNetwork,"['blockchain', 'ethereum', 'ethereum-contract', 'smart-contracts', 'solidity', 'solidity-contracts']",43.0,43.0,2022-06-04T00:02:04Z,2022-06-02T08:07:10Z,2017-04-28T12:11:32Z,88.0,428.0,Colony Network smart contracts,False,JavaScript
18598,155811,155839,coinbase/geoengineer,"['balance', 'cloud-resources', 'codifying-resources', 'dsl', 'infrastructure', 'ruby', 'workflow']",0.0,0.0,2020-01-16T23:50:36Z,2022-04-23T11:19:58Z,2016-07-22T18:15:01Z,56.0,404.0,DEPRECATED — Infrastructure As Code,False,Ruby
18599,155812,155840,checkstyle/eclipse-cs,"['analyzer', 'code-analysis', 'code-quality', 'eclipse-plugin', 'static-analysis']",50.0,50.0,2022-05-30T14:03:07Z,2022-05-28T15:42:29Z,2018-01-02T22:04:55Z,52.0,82.0,The Eclipse Checkstyle plug-in integrates the Checkstyle Java code auditor into the Eclipse IDE. The plug-in provides real-time feedback to the user about violations of rules that check for coding style and possible error prone code constructs. ,False,Java
18600,155822,155850,jbosstools/jbosstools-fuse,[],2.0,2.0,2022-06-02T08:20:54Z,2022-01-14T08:23:42Z,2012-10-16T19:45:49Z,105.0,84.0,JBoss Camel Developer Tools,False,HTML
18601,155831,155859,dotansimha/graphql-yoga,"['graphql', 'graphql-server', 'javascript', 'typescript', 'w3c']",38.0,38.0,2022-06-04T15:48:24Z,2022-06-04T02:15:09Z,2017-11-15T10:35:08Z,436.0,6969.0,"🧘 Rewrite of a fully-featured GraphQL Server with focus on easy setup, performance & great developer experience.  The core of Yoga implements W3C Fetch API and can run/deploy on any JS environment.",False,TypeScript
18602,155840,155868,Tiqa/redux-polyglot,"['bindings', 'i18n', 'javascript', 'middleware', 'polyglot', 'react', 'redux', 'redux-polyglot', 'translation']",31.0,31.0,2021-03-03T13:09:56Z,2021-10-29T22:44:21Z,2016-10-07T15:36:16Z,12.0,59.0,Polyglot.js bindings for Redux,False,JavaScript
18603,155863,155891,GrimoireGL/GrimoireJS,"['canvas', 'grimoire', 'webgl']",45.0,45.0,2020-06-01T01:10:58Z,2022-05-19T20:45:45Z,2015-03-26T05:18:34Z,24.0,344.0,A WebGL framework for Web development.,False,TypeScript
18604,155867,155895,tapaswenipathak/Open-Source-Programs,[],23.0,23.0,2022-05-16T16:55:48Z,2022-06-04T18:34:26Z,2015-11-27T03:37:32Z,696.0,2866.0,A list of open source programs.,False,JavaScript
18605,155875,155903,hitobito/hitobito,"['community', 'complex-group-hierarchies', 'hacktoberfest', 'hitobito', 'membership-management', 'ruby', 'wagons']",284.0,284.0,2022-06-03T14:51:22Z,2022-05-30T13:04:34Z,2013-07-30T12:33:41Z,79.0,256.0,"A web application to manage complex group hierarchies with members, events and a lot more.",False,Ruby
18606,155876,155904,parro-it/open-ssh-tunnel,[],3.0,3.0,2020-06-03T09:19:04Z,2022-05-17T07:56:00Z,2015-12-01T18:14:19Z,10.0,53.0,Easy ssh2 tunneling,False,JavaScript
18607,155877,155905,NativeScript/nativescript-dev-appium,"['appium', 'automation', 'automation-ui', 'e2e', 'nativescript', 'nativescript-dev-appium', 'testing']",27.0,27.0,2021-03-08T15:57:46Z,2021-12-23T00:06:59Z,2016-05-11T14:42:18Z,26.0,69.0,A package to help with writing and executing e2e Appium tests in NativeScript apps,False,TypeScript
18608,155879,155907,NeurodataWithoutBorders/nwb_hackathons,"['dataformat', 'hackathon', 'hdf', 'hdf5', 'international-conference', 'neurodata-without-borders', 'neuroscience', 'nwb', 'nwb-n', 'open-data', 'open-science', 'open-source', 'pynwb', 'python', 'reproducible-research']",2.0,2.0,2022-06-04T15:27:56Z,2021-12-08T14:39:43Z,2018-01-12T23:42:41Z,80.0,12.0,Repository for collecting materials from nwb hackathons,False,Jupyter Notebook
18609,155882,155910,callstack/react-native-ios-kit,"['ios-ui', 'react-native', 'ui-kit']",55.0,55.0,2022-06-03T22:43:00Z,2022-06-04T00:54:50Z,2017-07-27T11:27:16Z,51.0,443.0,The missing React Native UI Kit for iOS,False,JavaScript
18610,155884,155912,twitchtv/twirp,"['go', 'protobuf', 'rpc', 'twirp']",6.0,6.0,2022-06-04T18:39:21Z,2022-06-04T10:14:29Z,2018-01-16T16:37:30Z,301.0,5821.0,A simple RPC framework with protobuf service definitions,False,Go
18611,155886,155914,typicode/hotel,"['devtools', 'front-end', 'https', 'local', 'local-domain', 'process-manager', 'proxy']",122.0,122.0,2021-03-05T23:51:04Z,2022-06-03T16:19:35Z,2015-05-27T08:24:07Z,464.0,9769.0,🏩 A simple process manager for developers. Start apps from your browser and access them using local domains,False,JavaScript
18612,155888,155916,dzcpy/transliteration,"['ascii', 'character', 'slugify', 'transliteration', 'unicode', 'utf-8']",17.0,17.0,2021-09-27T08:39:08Z,2022-05-28T15:44:18Z,2014-08-27T07:45:46Z,49.0,496.0,"UTF-8 to ASCII transliteration / slugify module for node.js, browser, Web Worker, React Native, Electron and CLI.",False,TypeScript
18613,155889,155917,NativeScript/ios-runtime,"['ios', 'javascriptcore', 'nativescript', 'runtime']",109.0,109.0,2022-03-31T18:07:05Z,2022-05-30T08:18:21Z,2015-01-22T11:21:31Z,61.0,291.0,iOS Runtime for NativeScript,False,JavaScript
18614,155890,155918,zouhir/jarvis,"['build-tool', 'dashboard', 'webpack']",20.0,20.0,2019-01-07T02:18:46Z,2022-06-04T15:58:50Z,2017-08-18T00:43:12Z,209.0,5444.0,A very intelligent browser based Webpack dashboard,False,JavaScript
18615,155894,155922,AnalyticalGraphicsInc/gltf-vscode,"['gltf', 'vscode-extension']",25.0,25.0,2022-06-02T13:43:39Z,2022-05-26T07:50:12Z,2017-03-17T19:10:58Z,53.0,342.0,This is an extension for Visual Studio Code to add support for editing glTF files.,False,TypeScript
18616,155896,155924,NativeScript/nativescript-angular,"['android', 'angular', 'angular-cli', 'ios', 'mobile', 'nativescript']",292.0,292.0,2021-04-06T20:25:29Z,2022-05-31T06:35:59Z,2015-05-20T14:00:37Z,251.0,1212.0,Integrating NativeScript with Angular,False,TypeScript
18617,155898,155926,Samsung/TizenFX,"['c-sharp', 'device-apis', 'dotnet', 'tizen', 'tizenfx']",25.0,25.0,2022-06-04T15:07:30Z,2022-06-02T23:10:34Z,2017-12-22T04:30:55Z,210.0,146.0,C# Device APIs for Tizen,False,C#
18618,155903,155931,clinicjs/node-clinic-bubbleprof,[],21.0,21.0,2022-01-19T16:55:10Z,2022-05-04T11:57:26Z,2017-10-12T11:18:51Z,11.0,83.0,Programmable interface to `clinic bubbleprof`,False,JavaScript
18619,155907,155935,NativeScript/nativescript-marketplace-demo,[],11.0,11.0,2020-02-07T09:15:41Z,2022-05-14T05:46:03Z,2015-07-31T08:54:45Z,106.0,329.0,NativeScript kitchen sink demo. All of NativeScript’s functionality in one app.,False,TypeScript
18620,155910,155938,NativeScript/nativescript-vscode-extension,[],56.0,56.0,2021-09-22T21:45:55Z,2022-04-09T03:36:19Z,2015-12-07T08:58:29Z,33.0,80.0,A Visual Studio Code Extension for NativeScript,False,TypeScript
18621,155912,155940,NativeScript/android-runtime,"['android', 'cross-platform', 'hacktoberfest', 'mobile', 'nativescript', 'runtime']",96.0,96.0,2022-06-01T20:42:44Z,2022-05-29T14:47:09Z,2015-01-12T14:00:42Z,128.0,443.0,Android runtime for NativeScript (based on V8),False,C++
18622,155913,155941,NativeScript/nativescript-facebook,"['facebook', 'facebook-sdk', 'login', 'logout', 'nativescript', 'nativescript-plugin']",21.0,21.0,2022-06-03T05:02:28Z,2021-11-05T14:42:47Z,2017-03-13T15:21:48Z,53.0,80.0,"NativeScript plugin, wrapper of native Facebook SDK for Android and iOS",False,TypeScript
18623,155915,155943,NativeScript/nativescript-geolocation,"['android', 'geolocation', 'ios', 'mobile', 'nativescript', 'plugin']",33.0,33.0,2021-06-21T09:33:12Z,2022-05-29T08:54:32Z,2015-12-12T12:28:21Z,77.0,135.0,"Geolocation plugin to use for getting current location, monitor movement, etc",False,TypeScript
18624,155916,155944,NativeScript/nativescript-background-http,[],30.0,30.0,2021-04-13T05:11:58Z,2021-12-06T06:31:06Z,2015-08-31T11:38:55Z,56.0,103.0,Background Upload plugin for the NativeScript framework,False,TypeScript
18625,155917,155945,NativeScript/nativescript-fresco,"['android', 'fresco', 'images', 'ios', 'mobile', 'nativescript']",8.0,8.0,2019-04-18T20:04:03Z,2021-08-18T07:00:31Z,2016-01-26T16:12:48Z,24.0,52.0,This repository holds the NativeScript plugin that exposes the functionality of the Fresco image library to NativeScript developers.,False,TypeScript
18626,155924,155952,spacetelescope/hstcal,"['acs', 'astronomy', 'calibration', 'hst', 'pipeline', 'stis', 'wfc3']",88.0,88.0,2022-05-18T12:52:00Z,2022-04-06T09:53:00Z,2016-02-18T23:16:28Z,19.0,5.0,"Calibration for HST/WFC3, HST/ACS, and HST/STIS",False,C
18627,155925,155953,ThatGuyHughesy/creddit,"['clojure', 'clojure-library', 'clojure-wrapper', 'reddit', 'reddit-api', 'reddit-client']",1.0,1.0,2022-06-04T18:21:35Z,2021-10-25T15:08:07Z,2017-03-10T22:06:12Z,11.0,16.0,Clojure wrapper for Reddit API,False,Clojure
18628,155932,155960,nanoframework/nf-Community-Targets,"['community-boards', 'esp32', 'hacktoberfest', 'mcu', 'nanoframework', 'stm32']",1.0,1.0,2022-06-03T16:32:17Z,2022-06-04T05:00:40Z,2017-03-24T13:26:42Z,26.0,41.0,:construction_worker_man: Repository with target boards provided by nanoFramework community members,False,C
18629,155940,155968,WICG/cq-usecases,[],23.0,23.0,2019-09-27T19:56:46Z,2022-01-06T16:18:42Z,2014-05-21T17:14:37Z,26.0,186.0,Use cases and requirements for standardizing element queries.,False,HTML
18630,155961,155989,conekta/conekta-.net,[],13.0,13.0,2021-10-19T18:04:51Z,2022-05-04T00:19:07Z,2016-04-18T00:59:28Z,18.0,15.0,Conekta.net bindings,False,C#
18631,155967,155995,paritytech/sms-verification,[],16.0,16.0,2018-11-08T11:10:28Z,2022-03-10T09:55:11Z,2016-10-25T13:48:06Z,28.0,25.0,SMS verification for Parity.,False,JavaScript
18632,155972,156000,haskell/ecosystem-proposals,[],4.0,4.0,2019-01-10T14:39:22Z,2021-12-30T13:36:55Z,2016-12-09T12:16:33Z,14.0,51.0,Proposals for the Haskell Ecosystem,False,
18633,155975,156003,neillturner/kitchen-verifier-serverspec,[],9.0,9.0,2021-12-19T17:00:58Z,2021-12-19T16:53:44Z,2016-02-13T17:18:37Z,19.0,38.0,A Test Kitchen Serverspec Verifer without having to transit the Busser layer,False,Ruby
18634,155979,156007,ngx-translate/core,"['angular', 'angular2', 'i18n', 'ngx', 'ngx-translate', 'npm-package', 'translation']",418.0,418.0,2022-05-13T09:19:25Z,2022-06-04T09:35:47Z,2015-10-11T08:44:15Z,547.0,4139.0,The internationalization (i18n) library for Angular,False,TypeScript
18635,155983,156011,spacetelescope/fitsblender,[],9.0,9.0,2022-04-25T17:34:30Z,2021-12-09T21:55:38Z,2016-02-18T23:16:14Z,12.0,0.0,FITS header merging from multiple images.,False,Python
18636,155996,156024,microflo/microflo,"['arduino', 'dataflow', 'fbp', 'fbp-runtime', 'flowhub', 'microcontroller']",56.0,56.0,2020-05-23T11:45:59Z,2022-05-26T17:16:51Z,2013-09-17T17:36:18Z,25.0,214.0,Live dataflow programming for microcontrollers and embedded,False,CoffeeScript
18637,155997,156025,DIVGAMES/DIV-Games-Studio,"['3ds', 'android-development', 'c', 'cmake', 'cross-platform', 'development-utility', 'dos', 'games-studio', 'gcw-zero', 'linux', 'nintendo-3ds', 'osx', 'pandora-console', 'portable', 'raspberry-pi', 'sdl', 'sdl2', 'webgame', 'windows']",11.0,11.0,2019-02-19T17:29:33Z,2022-06-01T18:20:23Z,2016-11-21T15:10:34Z,28.0,187.0,"Complete cross platform games development package, originally for DOS but now available on modern platforms. ",False,C
18638,156009,156037,spacetelescope/wfc3tools,"['astronomy', 'data-analysis', 'hst', 'wfc3']",30.0,30.0,2022-03-10T17:27:04Z,2022-03-03T19:59:35Z,2016-02-18T23:34:37Z,17.0,3.0,Python tools for HST WFC3 data calibration and analysis,False,Python
18639,156010,156038,XXIIVV/oscean,"['assembly', 'exocortex', 'memex', 'uxn', 'wiki']",6.0,6.0,2022-06-04T16:19:52Z,2022-05-28T06:01:29Z,2017-11-22T18:58:35Z,75.0,393.0,Oscean wiki sources,False,HTML
18640,156022,156050,qooxdoo/qooxdoo,"['backend-agnostic', 'framework', 'javascript', 'qooxdoo', 'qooxdoo-package', 'ria', 'ui', 'uikit']",102.0,102.0,2022-06-03T20:07:57Z,2022-05-24T00:56:07Z,2010-03-05T10:01:27Z,251.0,727.0,qooxdoo - Universal JavaScript Framework,False,JavaScript
18641,156029,156057,mykeels/nigerian-constitution,"['constitution', 'laws', 'markdown', 'nigeria', 'opendata']",0.0,0.0,2018-02-19T23:18:43Z,2022-05-17T08:06:42Z,2018-01-29T16:13:36Z,22.0,72.0,Constitution and Laws of the Federal Republic of Nigeria,False,
18642,156032,156060,amadeus4dev/amadeus-node,"['ai', 'amadeus', 'api', 'flights', 'hotels', 'library', 'sdk', 'self-service', 'travel', 'travel-content', 'travel-insight']",10.0,10.0,2022-05-25T15:53:04Z,2022-05-26T10:02:11Z,2018-01-25T16:49:25Z,47.0,118.0,Node library for the Amadeus Self-Service travel APIs ,False,JavaScript
18643,156034,156062,tc39/proposal-class-fields,[],37.0,37.0,2022-01-24T20:55:32Z,2022-06-04T00:57:01Z,2017-05-14T14:59:18Z,121.0,1663.0,Orthogonally-informed combination of public and private fields proposals,False,HTML
18644,156036,156064,sandeepmistry/arduino-nRF5,[],91.0,91.0,2021-03-18T17:14:53Z,2022-05-21T22:18:04Z,2016-03-12T21:30:59Z,256.0,658.0,Arduino Core for Nordic Semiconductor nRF5 based boards,False,C
18645,156050,156078,kenshinji/yddict,"['dictionary', 'hacktoberfest', 'hacktoberfest2021', 'nodejs', 'npm-package']",5.0,5.0,2021-10-16T14:11:48Z,2022-05-27T04:47:41Z,2017-08-24T12:27:51Z,62.0,357.0,一个命令行查单词的工具💻 📚,False,JavaScript
18646,156054,156082,daranzolin/rcanvas,"['canvas-api', 'canvas-lms', 'instructure-canvas', 'r', 'rstats']",23.0,23.0,2021-04-27T22:40:55Z,2022-04-14T11:59:51Z,2016-09-21T21:42:03Z,35.0,69.0,R Client for Canvas LMS API,False,R
18647,156057,156085,eclipse/paho.mqtt.javascript,['mqtt'],87.0,87.0,2020-09-02T15:40:35Z,2022-06-01T01:40:49Z,2015-12-16T19:15:13Z,451.0,999.0,paho.mqtt.javascript,False,JavaScript
18648,156066,156094,microsoft/azure-pipelines-task-lib,[],21.0,21.0,2022-06-03T10:49:33Z,2022-05-25T11:45:34Z,2015-07-06T22:13:57Z,250.0,342.0,Libraries for writing VSTS and TFS build tasks,False,TypeScript
18649,156071,156099,getodk/validate,"['data-collection', 'global-development', 'global-health', 'java', 'mobile-data-collection', 'odk', 'social-impact', 'xforms']",7.0,7.0,2022-01-25T17:38:06Z,2022-01-25T17:36:05Z,2015-08-06T17:42:54Z,21.0,7.0,ODK Validate is a Java application for confirming that a form is valid and compliant with the ODK XForms specification. Contribute and make the world a better place! ✨🔍✨,False,Java
18650,156075,156103,yarpc/yarpc-go,"['go', 'grpc', 'message-passing', 'microservices', 'protobuf', 'rpc', 'thrift', 'yarpc']",18.0,18.0,2022-06-02T16:47:32Z,2022-05-31T09:19:58Z,2016-01-26T00:04:14Z,81.0,354.0,A message passing platform for Go,False,Go
18651,156076,156104,integrations/slack,"['github-app', 'probot-app']",339.0,339.0,2022-05-16T10:16:11Z,2022-06-04T19:03:26Z,2017-08-15T23:32:28Z,434.0,2010.0,Bring your code to the conversations you care about with the GitHub and Slack integration,False,
18652,156088,156116,lyft/react-javascript-to-typescript-transform,['lyft'],0.0,0.0,2019-09-20T23:52:13Z,2022-05-05T19:59:42Z,2017-06-21T18:06:17Z,64.0,1576.0,Convert React JavaScript code to TypeScript with proper typing,False,TypeScript
18653,156090,156118,PolymerElements/app-layout,[],38.0,38.0,2021-08-10T17:47:33Z,2022-04-21T03:24:48Z,2015-08-06T19:34:10Z,328.0,593.0,App layout elements,False,HTML
18654,156094,156122,rexray/gocsi,[],12.0,12.0,2022-05-26T06:42:21Z,2022-05-09T06:21:38Z,2017-08-14T23:26:38Z,63.0,137.0,"A Container Storage Interface (CSI) library, client, and other helpful utilities created with Go.",False,Go
18655,156096,156124,Arafatk/glot,"['golang', 'plotting']",15.0,15.0,2019-06-02T22:43:13Z,2022-05-29T14:04:56Z,2017-08-19T04:57:24Z,18.0,367.0,Glot is a plotting library for Golang built on top of gnuplot.,False,Go
18656,156101,156129,HomeServicesOfAmerica/styled-material-components,[],53.0,53.0,2020-04-07T15:13:59Z,2022-03-30T03:22:27Z,2017-05-26T22:31:13Z,54.0,75.0,Styled Components implementation of Material Design,False,JavaScript
18657,156105,156133,ctripcorp/nephele,[],4.0,4.0,2018-06-04T11:29:48Z,2021-11-21T01:47:08Z,2015-06-12T05:29:08Z,51.0,145.0,Image Service,False,Go
18658,156107,156135,kata-containers/ci,[],5.0,5.0,2022-06-03T18:22:09Z,2021-12-15T22:04:17Z,2018-02-02T09:34:32Z,19.0,10.0,Kata Containers CI,False,Shell
18659,156109,156137,asciidisco/web-conferences-2018,[],7.0,7.0,2019-01-27T16:58:26Z,2022-05-10T03:12:47Z,2017-12-04T16:22:52Z,109.0,601.0,A list of Web & JavaScript related conferences happening in 2018.,False,
18660,156115,156143,tintinweb/scapy-ssl_tls,"['dtls', 'python', 'scapy', 'scapy-ssl-tls', 'ssl', 'tls']",23.0,23.0,2021-09-21T17:48:20Z,2022-05-18T21:32:13Z,2014-06-23T23:45:25Z,164.0,382.0, SSL/TLS layers for scapy the interactive packet manipulation tool,False,Python
18661,156120,156148,src-d/code-annotation,"['annotations', 'labeling']",39.0,39.0,2019-10-08T13:24:13Z,2021-08-06T04:55:51Z,2018-01-12T00:52:13Z,26.0,22.0,🐈 Code Annotation Tool,False,JavaScript
18662,156122,156150,prebid/prebid-server,[],106.0,106.0,2022-06-03T21:59:37Z,2022-06-01T20:59:57Z,2017-04-17T13:38:32Z,479.0,259.0,Server side component to offload prebid processing to the cloud,False,Go
18663,156125,156153,sjsyrek/haskell-study-startup,"['education', 'functional-programming', 'haskell', 'study', 'study-group']",2.0,2.0,2019-10-18T20:34:23Z,2022-01-30T11:34:16Z,2017-09-07T13:53:53Z,54.0,276.0,Launch your own Haskell study group. Now.,False,
18664,156126,156154,dominique-mueller/simple-progress-webpack-plugin,"['logger', 'plugin', 'progress', 'simple', 'webpack']",7.0,7.0,2022-03-29T17:29:02Z,2022-05-02T04:32:50Z,2017-04-08T15:05:32Z,15.0,63.0,A simple progress plugin for Webpack.,False,JavaScript
18665,156133,156161,magda-io/magda,"['elasticsearch', 'kubernetes', 'nodejs', 'open-data', 'postgresql', 'scala']",374.0,374.0,2022-06-02T08:48:43Z,2022-06-03T09:24:45Z,2016-08-23T07:27:25Z,77.0,330.0,"A federated, open-source data catalog for all your big data and small data",False,JavaScript
18666,156134,156162,tunnckoCore/get-installed-path,"['detect', 'install', 'is-installed', 'modules', 'npm', 'package', 'path']",16.0,16.0,2022-01-22T05:27:08Z,2022-05-03T13:57:38Z,2015-04-18T00:57:44Z,10.0,40.0,Get locally or globally installation path of given package name.,False,JavaScript
18667,156138,156166,meejah/carml,[],6.0,6.0,2022-05-26T21:30:25Z,2022-05-08T00:24:57Z,2014-08-03T04:59:40Z,10.0,82.0,Command-line utility to control Tor.,False,Python
18668,156145,156173,walle-work/Walle.WorkFlowEngine,"['dotnet', 'dotnetcore', 'workflow-engine', 'workflow-management']",3.0,3.0,2018-02-23T17:41:41Z,2022-05-19T15:46:16Z,2017-12-08T11:30:53Z,46.0,88.0,"一款轻量级的工作流引擎,快速构建工单应用.",False,C#
18669,156157,156185,src-d/go-billy,"['abstraction', 'filesystem', 'golang']",15.0,15.0,2021-07-11T00:08:25Z,2022-05-21T18:23:09Z,2016-12-07T15:32:53Z,44.0,193.0,The missing interface filesystem abstraction for Go,False,Go
18670,156167,156195,mike-north/ember-material-lite,[],76.0,76.0,2022-05-15T20:03:51Z,2021-12-17T01:39:00Z,2015-07-07T15:29:37Z,50.0,148.0,Material Design Lite for Ember.js Apps,False,JavaScript
18671,156171,156199,gender-bias/gender-bias,"['evaluation', 'female', 'gender', 'gender-bias', 'implicit-bias', 'women']",22.0,22.0,2022-06-04T14:06:56Z,2022-03-23T03:07:41Z,2018-02-20T19:54:38Z,30.0,77.0,Reading for gender bias,False,Python
18672,156180,156208,pretalx/pretalx,"['call-for-paper', 'call-for-papers', 'cfp', 'conference', 'conference-management', 'django', 'events', 'pretalx', 'python', 'scheduling']",71.0,71.0,2022-06-01T14:41:49Z,2022-05-31T05:31:47Z,2017-02-24T20:46:51Z,131.0,436.0,"Conference planning tool: CfP, scheduling, speaker management",False,Python
18673,156182,156210,rstudio/rstudio,[],1203.0,1203.0,2022-06-04T18:28:34Z,2022-06-04T03:50:25Z,2010-12-07T19:10:25Z,969.0,3969.0,RStudio is an integrated development environment (IDE) for R,False,Java
18674,156189,156217,mike-north/ember-lodash,[],18.0,18.0,2022-05-16T01:12:04Z,2021-12-06T10:13:12Z,2015-07-05T20:45:28Z,37.0,76.0,Lodash as ES6 Modules for Ember.js Apps,False,JavaScript
18675,156199,156227,netevert/dnsmorph,"['dns', 'domains', 'go', 'golang', 'penetration-testing', 'pentest-tool', 'permutation-algorithms', 'permutations', 'phishing', 'phishing-attacks', 'phishing-sites', 'threat-intelligence', 'threatintel', 'typosquatting']",10.0,10.0,2021-06-07T21:24:35Z,2022-05-25T13:31:36Z,2018-02-20T19:13:35Z,36.0,188.0,Domain name permutation engine written in Go,False,Go
18676,156201,156229,perkeep/perkeep,[],403.0,403.0,2022-06-01T12:19:44Z,2022-06-04T04:44:17Z,2011-01-03T22:42:09Z,436.0,5909.0,"Perkeep (née Camlistore) is your personal storage system for life: a way of storing, syncing, sharing, modelling and backing up content.",False,Go
